{
  "$schema": "../../../tooling/quality/component.schema.json",
  "schemaVersion": 1,
  "name": "prompt-input",
  "title": "Prompt input",
  "version": "0.3.0",
  "maturity": "preview",
  "purpose": "Provide an accessible, source-owned message composer with clear empty, ready, multiline, submitting, and rejected-submission behavior plus optional context and toolbar composition without connecting to an AI service.",
  "anatomy": [
    { "name": "root", "description": "Semantic form and async submission boundary." },
    { "name": "leading", "description": "Optional context, selection, attachment, or mode summary." },
    { "name": "field", "description": "Visible input affordance and persistent accessible label relationship." },
    { "name": "input", "description": "Growing multiline message text area." },
    { "name": "toolbar", "description": "Secondary controls, guidance, and primary submit alignment." },
    { "name": "toolbar-start", "description": "Optional attachment, voice, model, or tool controls." },
    { "name": "hint", "description": "Concise keyboard or submission guidance." },
    { "name": "submit", "description": "Primary submit action with accessible name and async state." }
  ],
  "slots": [
    { "name": "leading", "description": "Context shown above the text field." },
    { "name": "toolbarStart", "description": "Attachment, voice, model, or tool controls before the hint." },
    { "name": "hint", "description": "Visible shortcut, privacy, or input guidance." }
  ],
  "states": [
    { "name": "default", "description": "Empty enabled composer with submit unavailable until meaningful input exists." },
    { "name": "ready", "description": "Non-empty composer with an available primary action." },
    { "name": "multiline", "description": "Long prompt grows within a bounded, scroll-safe field." },
    { "name": "submitting", "description": "Duplicate submission is prevented and progress remains understandable." },
    { "name": "submit-rejected", "description": "Input remains recoverable and the control returns to an operable state after rejection." }
  ],
  "variants": [
    { "name": "icon-submit", "description": "Default compact submit action with an accessible name." },
    { "name": "labeled-submit", "description": "Visible submit label for products needing stronger action affordance." },
    { "name": "with-leading-context", "description": "Context or attachment summary above the field." },
    { "name": "with-toolbar-controls", "description": "Secondary product controls composed before the hint." }
  ],
  "themes": [
    { "name": "light", "description": "Graphite-neutral light field and control treatment." },
    { "name": "dark", "description": "Near-black field with clear surface and focus distinction." },
    { "name": "high-contrast", "description": "Strengthened field, action, disabled, and focus boundaries." }
  ],
  "responsive": {
    "viewports": [
      { "name": "mobile", "width": 375, "expectation": "Toolbar wraps without covering input; controls remain touch-safe above the software keyboard." },
      { "name": "tablet", "width": 768, "expectation": "Field, secondary controls, hint, and submit retain a clear order." },
      { "name": "desktop", "width": 1024, "expectation": "Composer remains compact and does not stretch input copy beyond useful measure." },
      { "name": "wide", "width": 1440, "expectation": "Maximum width and internal alignment preserve connection to the transcript." }
    ]
  },
  "accessibility": {
    "semantics": "Uses a native form, labeled textarea, native submit button, discoverable visible guidance, and programmatically exposed disabled and submitting states; placeholder text is not the label.",
    "keyboard": [
      "Tab reaches the text area, optional toolbar controls, and submit in visual order.",
      "Native form submission does not override multiline text-entry or assistive-technology conventions.",
      "Submitting prevents duplicate activation without disabling unrelated recovery navigation."
    ],
    "focus": [
      "The field and every toolbar action retain visible focus in all declared themes.",
      "Submission completion or rejection does not move focus unexpectedly.",
      "Growing and wrapping content does not cover the focused line or submit action."
    ]
  },
  "motion": {
    "usesMotion": true,
    "reducedMotion": true,
    "levels": ["none", "subtle", "expressive"],
    "contract": "Focus, submit, and async feedback use short color, opacity, or transform transitions; reduced motion removes nonessential movement without delaying feedback."
  },
  "fixtures": {
    "file": "prompt-input.fixture.tsx",
    "scenarios": [
      { "name": "default", "description": "Empty composer and disabled submit action." },
      { "name": "ready", "description": "Short valid prompt and enabled submit action." },
      { "name": "multiline", "description": "Long localized prompt, line wrapping, and bounded growth." },
      { "name": "submitting", "description": "Pending async submit and duplicate prevention." },
      { "name": "submit-rejected", "description": "Rejected async submit returns to an operable state with retained recovery path." },
      { "name": "with-leading-context", "description": "Long context content above the field." },
      { "name": "with-toolbar-controls", "description": "Multiple secondary controls and a long hint." },
      { "name": "rtl", "description": "Bidirectional text, toolbar, and semantic submit icon meaning." }
    ]
  },
  "quality": {
    "visualRegression": true,
    "a11y": true,
    "interaction": true,
    "documentation": true,
    "evidence": {
      "visualRegression": "../../../apps/lab/tests/component-quality.spec.ts",
      "a11y": "../../../apps/lab/tests/component-quality.spec.ts",
      "interaction": "../../../apps/lab/tests/component-quality.spec.ts",
      "documentation": "README.md"
    }
  },
  "compatibility": {
    "aifrontkit": ">=0.1.0 <1",
    "react": ">=18.3 <20",
    "schemaMajor": 1,
    "registryDependencies": [],
    "runtimeDependencies": ["@aifrontkit/react"],
    "platformRuntimeRequired": false
  }
}
