{
  "$schema": "../../../tooling/quality/component.schema.json",
  "schemaVersion": 1,
  "name": "message",
  "title": "Message",
  "version": "0.4.0",
  "maturity": "preview",
  "purpose": "Present normalized user, assistant, and system message content with quiet role hierarchy, bounded rich content, event-level status, and optional identity, metadata, actions, and recovery without calling a model or platform service.",
  "anatomy": [
    { "name": "root", "description": "Semantic article bound to normalized runtime message state." },
    { "name": "body", "description": "Role-aware alignment and presentation container." },
    { "name": "avatar", "description": "Optional decorative or product identity mark." },
    { "name": "header", "description": "Conditional role and metadata row." },
    { "name": "content", "description": "Primary message content and rich renderer boundary." },
    { "name": "state", "description": "Streaming, failure, interruption, and recovery region." },
    { "name": "actions", "description": "Actions applying to the message content." },
    { "name": "status", "description": "Optional polite event-level announcement." }
  ],
  "slots": [
    { "name": "children", "description": "Custom Markdown or rich-content renderer." },
    { "name": "avatar", "description": "Optional assistant or participant identity." },
    { "name": "metadata", "description": "Timestamp, model, source, or other secondary context." },
    { "name": "actions", "description": "Copy, feedback, retry, citation, or product actions." },
    { "name": "recovery", "description": "Retry or alternate action for failed or interrupted output." }
  ],
  "states": [
    { "name": "default", "description": "Completed message with role-appropriate hierarchy." },
    { "name": "streaming", "description": "Partial content and restrained progress indication." },
    { "name": "interrupted", "description": "Retained partial content and explicit interruption status." },
    { "name": "failed", "description": "Associated error text and optional recovery action." },
    { "name": "long-content", "description": "Long prose, code, links, and unbroken identifiers remain bounded." }
  ],
  "variants": [
    { "name": "minimal", "description": "Lowest-chrome presentation for compact compositions." },
    { "name": "conversation", "description": "Default transcript presentation with a chromeless assistant and quiet user surface." },
    { "name": "dense", "description": "Reduced whitespace for activity-dense surfaces without smaller touch targets." },
    { "name": "workspace", "description": "Message presentation suited to split-pane product workspaces." }
  ],
  "themes": [
    { "name": "light", "description": "Graphite-neutral light presentation." },
    { "name": "dark", "description": "Near-black presentation with readable secondary content." },
    { "name": "high-contrast", "description": "Strengthened status, focus, and boundary distinction." }
  ],
  "responsive": {
    "viewports": [
      { "name": "mobile", "width": 375, "expectation": "User width remains bounded and actions are touch-safe without page overflow." },
      { "name": "tablet", "width": 768, "expectation": "Content and action alignment remain visually connected." },
      { "name": "desktop", "width": 1024, "expectation": "Assistant content preserves readable measure." },
      { "name": "wide", "width": 1440, "expectation": "Prose does not expand to an unreadable line length." }
    ]
  },
  "accessibility": {
    "semantics": "Uses a semantic message article with normalized role context, bounded content, visible error text, keyboard-reachable actions, and one optional polite status announcement that does not include token-by-token deltas.",
    "keyboard": [
      "Tab reaches each message action and recovery control in visual order.",
      "Hover-disclosed actions also appear on focus-within and remain discoverable on touch layouts.",
      "Custom content does not trap focus inside code, links, or embedded renderers."
    ],
    "focus": [
      "Message actions and recovery controls retain visible focus in every declared theme.",
      "Streaming, completion, failure, and interruption do not move focus.",
      "Removing transient status never removes the currently focused action."
    ]
  },
  "motion": {
    "usesMotion": true,
    "reducedMotion": true,
    "levels": ["none", "subtle", "expressive"],
    "contract": "Entry and streaming indicators use bounded transform or opacity; content deltas do not animate and reduced motion disables nonessential movement."
  },
  "fixtures": {
    "file": "message.fixture.tsx",
    "scenarios": [
      { "name": "default", "description": "Completed assistant message with actions." },
      { "name": "streaming", "description": "Partial response and event-level status." },
      { "name": "interrupted", "description": "Partial content retained with interruption meaning." },
      { "name": "failed", "description": "Partial content, error text, and recovery." },
      { "name": "long-content", "description": "Prose, code, URL, and unbroken text stress." },
      { "name": "user-role", "description": "Quiet, right-aligned user presentation." },
      { "name": "system-role", "description": "Low-emphasis system context with explicit labeling." },
      { "name": "without-slots", "description": "No avatar, metadata, action, or recovery residue." },
      { "name": "rtl", "description": "Bidirectional content and action order." }
    ]
  },
  "quality": {
    "visualRegression": true,
    "a11y": true,
    "interaction": true,
    "documentation": true,
    "evidence": {
      "visualRegression": "../../../apps/lab/tests/component-quality.spec.ts",
      "a11y": "../../../apps/lab/tests/component-quality.spec.ts",
      "interaction": "../../../apps/lab/tests/component-quality.spec.ts",
      "documentation": "README.md"
    }
  },
  "compatibility": {
    "aifrontkit": ">=0.1.0 <1",
    "react": ">=18.3 <20",
    "schemaMajor": 1,
    "registryDependencies": [],
    "runtimeDependencies": ["@aifrontkit/react"],
    "platformRuntimeRequired": false
  }
}
